Clinic Name,Address,City,State,Phone,Website,Description
Premium Fertility Fertility Centre,"538 Sardar Patel Center, Srinagar, Jammu and Kashmir",Srinagar,Jammu and Kashmir,+91-0169-41475345,https://www.premiumfertilityfertilitycentrehospital.com,Comprehensive infertility treatment with state-of-the-art technology
Top IVF IVF Ocean,"423 North Colony, Jammu, Jammu and Kashmir",Jammu,Jammu and Kashmir,+91-0185-87944514,https://www.topivfivfoceanivf.com,Specialized IVF clinic with experienced fertility specialists
Crystal IVF IVF Care,"45 Shivaji Avenue, Biharsharif, Bihar",Biharsharif,Bihar,+91-0183-64473323,https://www.crystalivfivfcareclinic.com,Advanced IVF clinic with proven success rates
Emerald IVF IVF Prairie,"573 Vijay Avenue, Bulandshahr, Uttar Pradesh",Bulandshahr,Uttar Pradesh,+91-0137-73635817,https://www.emeraldivfivfprairiefertility.com,Advanced fertility clinic with cutting-edge technology
Diamond Fertility IVF Ferry,"849 New Center, Chapra, Bihar",Chapra,Bihar,+91-0162-95848135,https://www.diamondfertilityivfferryclinic.com,Complete reproductive health and fertility services
Sapphire Fertility Fertility Valley,"844 Bose Nagar, Patna, Bihar",Patna,Bihar,+91-0126-66280071,https://www.sapphirefertilityfertilityvalleyhospital.com,Leading IVF and fertility treatment facility
Optimal IVF Fertility Adventure,"108 Vijay Avenue, Moradabad, Uttar Pradesh",Moradabad,Uttar Pradesh,+91-0151-87512705,https://www.optimalivffertilityadventurehealth.com,"Complete fertility solutions including IVF, ICSI, and fertility preservation"
Premier Fertility IVF Canal,"69 Vijay Road, Kollam, Kerala",Kollam,Kerala,+91-0129-83218331,https://www.premierfertilityivfcanalfertility.com,Comprehensive fertility treatment and reproductive health services
Best Fertility Super Speciality Hospital,"211 Central Center, Mysore, Karnataka",Mysore,Karnataka,+91-080-18300307,https://www.bestfertilitysuperspecialityhospitalhealth.com,Expert fertility specialists providing comprehensive care
Select Fertility Fertility Valley,"186 Sector Clinic, Sri Ganganagar, Rajasthan",Sri Ganganagar,Rajasthan,+91-0194-53873825,https://www.selectfertilityfertilityvalleycare.com,Comprehensive infertility treatment solutions
Premium IVF Fertility Plain,"109 Sector Road, Patiala, Punjab",Patiala,Punjab,+91-044-16939889,https://www.premiumivffertilityplainclinic.com,Dedicated to helping couples achieve their dream of parenthood
Fine Fertility Fertility Adventure,"331 Gandhi Nagar Road, Raurkela, Odisha",Raurkela,Odisha,+91-0189-34517643,https://www.finefertilityfertilityadventurehealth.com,"Complete fertility solutions including IVF, ICSI, and fertility preservation"
Supreme Fertility Fertility Court,"480 Sonia Street, Sonipat, Haryana",Sonipat,Haryana,+91-0189-50733671,https://www.supremefertilityfertilitycourtcenter.com,Leading IVF and fertility treatment facility
Shivani Fertility Mountain,"143 Bose Center, Vellore, Tamil Nadu",Vellore,Tamil Nadu,+91-0144-92427982,https://www.shivanifertilitymountainhealth.com,Expert fertility care with personalized treatment plans
Ruby IVF Fertility Drive,"179 Central Colony, Yamunanagar, Haryana",Yamunanagar,Haryana,+91-0131-83197585,https://www.rubyivffertilitydrivehealth.com,Advanced assisted reproductive technology center
Emerald IVF Fertility Future,"101 Modi Complex, Rampur, Uttar Pradesh",Rampur,Uttar Pradesh,+91-0148-54255620,https://www.emeraldivffertilityfuturehospital.com,Advanced fertility clinic with cutting-edge technology
Vir k Fertility Target,"926 MG Lane, Anand, Gujarat",Anand,Gujarat,+91-020-74023934,https://www.virkfertilitytargethealth.com,Dedicated to helping couples achieve their dream of parenthood
Superior Fertility Fertility Summit,"229 New Clinic, Amritsar, Punjab",Amritsar,Punjab,+91-080-75507758,https://www.superiorfertilityfertilitysummitcenter.com,Advanced reproductive medicine center with high success rates
Akanksha Fertility Reservoir,"382 Modi Hospital, Secunderabad, Telangana",Secunderabad,Telangana,+91-0140-59991301,https://www.akankshafertilityreservoircenter.com,Comprehensive infertility treatment solutions
Advanced Fertility IVF Prairie,"208 Gandhi Nagar Nagar, Mirzapur, Uttar Pradesh",Mirzapur,Uttar Pradesh,+91-0137-39950266,https://www.advancedfertilityivfprairiemedical.com,Advanced fertility clinic with cutting-edge technology
Optimal IVF Fertility Spring,"444 Phase Colony, Haldwani, Uttarakhand",Haldwani,Uttarakhand,+91-0141-63954801,https://www.optimalivffertilityspringclinic.com,State-of-the-art fertility treatment center
Wonderful Fertility IVF Summit,"593 South Avenue, Ozhukarai, Puducherry",Ozhukarai,Puducherry,+91-0181-17929357,https://www.wonderfulfertilityivfsummitfertility.com,Specialized center for infertility diagnosis and treatment
Ruby IVF Fertility Mission,"841 Sardar Patel Hospital, Nellore, Andhra Pradesh",Nellore,Andhra Pradesh,+91-0124-32453013,https://www.rubyivffertilitymissionhealth.com,Advanced fertility clinic with cutting-edge technology
Remarkable Fertility Fertility Bridge,"335 Ambedkar Complex, Vijayanagaram, Andhra Pradesh",Vijayanagaram,Andhra Pradesh,+91-0128-26511408,https://www.remarkablefertilityfertilitybridgecare.com,Leading IVF and fertility treatment facility
Choice IVF IVF Yacht,"400 Tagore Center, Ludhiana, Punjab",Ludhiana,Punjab,+91-0162-79035485,https://www.choiceivfivfyachtcenter.com,Leading IVF and fertility treatment facility
Select Fertility IVF Drive,"360 South Avenue, Bhavnagar, Gujarat",Bhavnagar,Gujarat,+91-0188-58768058,https://www.selectfertilityivfdrivefertility.com,Specialized fertility care and reproductive medicine
Top IVF IVF Aim,"661 North Street, Saharanpur, Uttar Pradesh",Saharanpur,Uttar Pradesh,+91-0155-97057091,https://www.topivfivfaimivf.com,Advanced assisted reproductive technology center
Choice IVF Fertility Mission,"685 Gandhi Lane, Bahraich, Uttar Pradesh",Bahraich,Uttar Pradesh,+91-0143-72805319,https://www.choiceivffertilitymissionmedical.com,Advanced reproductive medicine center with high success rates
Chosen Fertility Fertility Street,"334 Old Street, Ujjain, Madhya Pradesh",Ujjain,Madhya Pradesh,+91-0123-75436689,https://www.chosenfertilityfertilitystreetfertility.com,Comprehensive infertility treatment solutions
Choice IVF Fertility Lake,"499 Raj Clinic, Nellore, Andhra Pradesh",Nellore,Andhra Pradesh,+91-0194-17221560,https://www.choiceivffertilitylakehospital.com,Expert fertility specialists providing comprehensive care
Nice Fertility IVF Way,"856 Sonia Complex, Mango, Jharkhand",Mango,Jharkhand,+91-0195-12988381,https://www.nicefertilityivfwayhealth.com,Complete reproductive health and fertility services
Top IVF IVF Sea,"917 Shivaji Clinic, Burhanpur, Madhya Pradesh",Burhanpur,Madhya Pradesh,+91-0165-48491342,https://www.topivfivfseafertility.com,Specialized IVF clinic with experienced fertility specialists
Crystal IVF Fertility Valley,"468 New Center, Vijayanagaram, Andhra Pradesh",Vijayanagaram,Andhra Pradesh,+91-0175-68661825,https://www.crystalivffertilityvalleycare.com,State-of-the-art fertility treatment center
Select Fertility Fertility Voyage,"34 Bose Road, Kamarhati, West Bengal",Kamarhati,West Bengal,+91-0148-50565981,https://www.selectfertilityfertilityvoyagehealth.com,Comprehensive fertility treatment and reproductive health services
Excellent IVF IVF Peninsula,"386 Ambedkar Colony, Howrah, West Bengal",Howrah,West Bengal,+91-0186-95299930,https://www.excellentivfivfpeninsulaclinic.com,Advanced assisted reproductive technology center
Fantastic Fertility IVF Quest,"577 Modi Hospital, Satara, Maharashtra",Satara,Maharashtra,+91-0172-30950565,https://www.fantasticfertilityivfquestmedical.com,Specialized IVF clinic with experienced fertility specialists
Care IVF IVF Lake,"101 Shivaji Colony, Ahmednagar, Maharashtra",Ahmednagar,Maharashtra,+91-0175-43395858,https://www.careivfivflakefertility.com,Expert fertility specialists providing comprehensive care
Premier Fertility Fertility Boulevard,"609 Raj Center, Bhilai, Chhattisgarh",Bhilai,Chhattisgarh,+91-0161-52081174,https://www.premierfertilityfertilityboulevardclinic.com,Dedicated to helping couples achieve their dream of parenthood
Choice IVF Fertility Sea,"747 North Road, Loni, Uttar Pradesh",Loni,Uttar Pradesh,+91-0151-10751630,https://www.choiceivffertilityseaclinic.com,Comprehensive infertility treatment with state-of-the-art technology
Ruby IVF IVF Dream,"375 Sector Road, Haldwani, Uttarakhand",Haldwani,Uttarakhand,+91-0174-40360332,https://www.rubyivfivfdreammedical.com,Specialized IVF clinic with experienced fertility specialists
Good IVF Fertility Ship,"718 MG Complex, Agartala, Tripura",Agartala,Tripura,+91-0159-78790608,https://www.goodivffertilityshipclinic.com,Expert fertility specialists providing comprehensive care
Ruby IVF Fertility Centre,"628 Central Clinic, Raipur, Chhattisgarh",Raipur,Chhattisgarh,+91-0191-46206670,https://www.rubyivffertilitycentremedical.com,Expert fertility specialists providing comprehensive care
Exceptional IVF IVF Adventure,"330 Tagore Hospital, Amritsar, Punjab",Amritsar,Punjab,+91-020-10691544,https://www.exceptionalivfivfadventurehospital.com,Leading IVF and fertility treatment facility
Nice Fertility IVF Canal,"45 Main Hospital, Munger, Bihar",Munger,Bihar,+91-0149-87760265,https://www.nicefertilityivfcanalfertility.com,Expert fertility care with personalized treatment plans
Exceptional IVF IVF Savannah,"9 Central Lane, Muzaffarpur, Bihar",Muzaffarpur,Bihar,+91-0139-20249031,https://www.exceptionalivfivfsavannahivf.com,Specialized center for infertility diagnosis and treatment
Nice Fertility IVF Adventure,"517 Block Avenue, Firozabad, Uttar Pradesh",Firozabad,Uttar Pradesh,+91-0176-73400568,https://www.nicefertilityivfadventurecare.com,Modern fertility clinic equipped with latest medical technology
Premier Fertility Fertility Program,"457 New Nagar, Deoghar, Jharkhand",Deoghar,Jharkhand,+91-0181-14440404,https://www.premierfertilityfertilityprogramcenter.com,Advanced IVF clinic with proven success rates
Akanksha IVF Care,"621 Old Nagar, Udaipur, Rajasthan",Udaipur,Rajasthan,+91-0191-80329435,https://www.akankshaivfcarehealth.com,State-of-the-art fertility treatment center
Chosen Fertility IVF Ocean,"537 North Complex, Rohtak, Haryana",Rohtak,Haryana,+91-0173-39417835,https://www.chosenfertilityivfoceanivf.com,Expert fertility specialists providing comprehensive care
Fertility First Fertility Expedition,"361 East Avenue, Rourkela, Odisha",Rourkela,Odisha,+91-020-97205878,https://www.fertilityfirstfertilityexpeditionfertility.com,Advanced assisted reproductive technology center
Royal Fertility Fertility Dream,"59 Raj Road, Bhalswa Jahangir Pur, Delhi",Bhalswa Jahangir Pur,Delhi,+91-0158-26264688,https://www.royalfertilityfertilitydreamivf.com,Advanced fertility clinic with cutting-edge technology
Amazing IVF Fertility Journey,"347 Jawaharlal Nehru Lane, Naihati, West Bengal",Naihati,West Bengal,+91-0139-54305245,https://www.amazingivffertilityjourneyhealth.com,Advanced reproductive medicine center with high success rates
Fine Fertility Fertility Center,"334 Raj Complex, Jalandhar, Punjab",Jalandhar,Punjab,+91-0121-15649163,https://www.finefertilityfertilitycenterfertility.com,Advanced assisted reproductive technology center
Fine Fertility Fertility Plan,"613 South Avenue, Delhi, Delhi",Delhi,Delhi,+91-0129-55692991,https://www.finefertilityfertilityplanhospital.com,Leading fertility treatment center offering advanced ART procedures
Ideal Fertility IVF Ridge,"297 Ashok Hospital, Nandyal, Andhra Pradesh",Nandyal,Andhra Pradesh,+91-0177-68170837,https://www.idealfertilityivfridgehealth.com,Advanced fertility clinic with cutting-edge technology
Perfect IVF Fertility Institute,"198 North Nagar, Bhavnagar, Gujarat",Bhavnagar,Gujarat,+91-0150-15090862,https://www.perfectivffertilityinstitutehospital.com,Leading IVF and fertility treatment facility
Ideal Fertility IVF Expedition,"12 Indira Clinic, Noida, Uttar Pradesh",Noida,Uttar Pradesh,+91-0190-13531949,https://www.idealfertilityivfexpeditionhospital.com,Complete reproductive health and fertility services
Good IVF IVF Lake,"116 Sector Center, Cuttack, Odisha",Cuttack,Odisha,+91-0158-84774957,https://www.goodivfivflakeclinic.com,Advanced IVF clinic with proven success rates
Nova IVF Ocean,"603 Vijay Colony, Jodhpur, Rajasthan",Jodhpur,Rajasthan,+91-0138-38852744,https://www.novaivfoceanclinic.com,Dedicated to helping couples achieve their dream of parenthood
Remarkable Fertility Fertility Path,"120 Jawaharlal Nehru Avenue, Bhopal, Madhya Pradesh",Bhopal,Madhya Pradesh,+91-0186-62089146,https://www.remarkablefertilityfertilitypathcenter.com,Specialized center for infertility diagnosis and treatment
Select Fertility IVF Square,"538 Sonia Colony, Noida, Uttar Pradesh",Noida,Uttar Pradesh,+91-0129-31689296,https://www.selectfertilityivfsquarecenter.com,Modern fertility clinic equipped with latest medical technology
Superb Fertility IVF Boulevard,"460 Shivaji Road, Bidhan Nagar, West Bengal",Bidhan Nagar,West Bengal,+91-0126-62054467,https://www.superbfertilityivfboulevardcenter.com,Expert fertility specialists providing comprehensive care
Optimal IVF IVF Plateau,"331 New Clinic, Belgaum, Karnataka",Belgaum,Karnataka,+91-0148-23193512,https://www.optimalivfivfplateauclinic.com,Comprehensive fertility treatment and reproductive health services
Remarkable Fertility Fertility Avenue,"527 East Complex, Aligarh, Uttar Pradesh",Aligarh,Uttar Pradesh,+91-0123-71311300,https://www.remarkablefertilityfertilityavenueivf.com,Advanced fertility clinic with cutting-edge technology
Prime Fertility Fertility Aqueduct,"734 Shivaji Road, Gorakhpur, Uttar Pradesh",Gorakhpur,Uttar Pradesh,+91-0189-72692284,https://www.primefertilityfertilityaqueducthospital.com,"Complete fertility solutions including IVF, ICSI, and fertility preservation"
Supreme Fertility Fertility Street,"925 Sector Street, Shorapur, Karnataka",Shorapur,Karnataka,+91-0135-51722975,https://www.supremefertilityfertilitystreethospital.com,Specialized center for infertility diagnosis and treatment
Fantastic Fertility IVF Mountain,"899 Gandhi Colony, Noida, Uttar Pradesh",Noida,Uttar Pradesh,+91-0183-80637903,https://www.fantasticfertilityivfmountainhealth.com,Comprehensive infertility treatment solutions
Emerald IVF IVF Valley,"435 Old Road, Madhyamgram, West Bengal",Madhyamgram,West Bengal,+91-0178-14010691,https://www.emeraldivfivfvalleycare.com,Expert fertility care with personalized treatment plans
Great IVF IVF Mountain,"520 MG Colony, Noida, Uttar Pradesh",Noida,Uttar Pradesh,+91-0156-15050915,https://www.greativfivfmountainivf.com,Advanced assisted reproductive technology center
Diamond Fertility Fertility Viaduct,"22 Sonia Road, Karnal, Haryana",Karnal,Haryana,+91-0198-60273875,https://www.diamondfertilityfertilityviaductfertility.com,Leading IVF and fertility treatment facility
Good IVF Fertility Point,"524 East Street, Rourkela, Odisha",Rourkela,Odisha,+91-0180-45722638,https://www.goodivffertilitypointivf.com,Comprehensive infertility treatment with state-of-the-art technology
Remarkable Fertility Fertility Ridge,"89 North Avenue, Visakhapatnam, Andhra Pradesh",Visakhapatnam,Andhra Pradesh,+91-0191-17671802,https://www.remarkablefertilityfertilityridgecenter.com,Comprehensive infertility treatment solutions
Premium IVF IVF Bay,"754 South Road, Nangloi Jat, Delhi",Nangloi Jat,Delhi,+91-0176-76818739,https://www.premiumivfivfbayfertility.com,Specialized IVF clinic with experienced fertility specialists
Prime IVF Fertility Center,"878 North Lane, Guntur, Andhra Pradesh",Guntur,Andhra Pradesh,+91-0158-15086616,https://www.primeivffertilitycentercenter.com,Advanced fertility clinic with cutting-edge technology
Chosen Fertility Fertility Sea,"984 East Street, Anantnag, Jammu and Kashmir",Anantnag,Jammu and Kashmir,+91-0185-49440386,https://www.chosenfertilityfertilityseahealth.com,Specialized IVF clinic with experienced fertility specialists
Prime Fertility Fertility Cape,"970 Gandhi Nagar Street, Jodhpur, Rajasthan",Jodhpur,Rajasthan,+91-011-91181382,https://www.primefertilityfertilitycapeivf.com,Comprehensive infertility treatment with state-of-the-art technology
Excellent IVF Fertility Cape,"400 Vijay Road, Dhule, Maharashtra",Dhule,Maharashtra,+91-0126-23753835,https://www.excellentivffertilitycapemedical.com,State-of-the-art fertility treatment center
Perfect IVF IVF Program,"395 Gandhi Lane, Patna, Bihar",Patna,Bihar,+91-0140-25208711,https://www.perfectivfivfprogramclinic.com,Specialized IVF clinic with experienced fertility specialists
Ultimate IVF IVF Target,"499 North Road, Bhatpara, West Bengal",Bhatpara,West Bengal,+91-0139-73413873,https://www.ultimateivfivftargetclinic.com,Advanced IVF clinic with proven success rates
Superb Fertility IVF Spring,"169 Indira Lane, Berhampur, Odisha",Berhampur,Odisha,+91-0191-72150402,https://www.superbfertilityivfspringfertility.com,Dedicated to helping couples achieve their dream of parenthood
Remarkable Fertility IVF Target,"44 Central Colony, Gandhidham, Gujarat",Gandhidham,Gujarat,+91-0136-21021686,https://www.remarkablefertilityivftargetfertility.com,Leading fertility treatment center offering advanced ART procedures
Supreme Fertility Fertility Crest,"810 West Nagar, Hospet, Karnataka",Hospet,Karnataka,+91-0183-30667704,https://www.supremefertilityfertilitycrestmedical.com,Leading fertility treatment center offering advanced ART procedures
Amazing IVF Fertility Dam,"702 Block Clinic, Firozabad, Uttar Pradesh",Firozabad,Uttar Pradesh,+91-022-36343770,https://www.amazingivffertilitydamclinic.com,Comprehensive fertility treatment and reproductive health services
Ruby IVF Fertility Bay,"603 MG Road, Cuttack, Odisha",Cuttack,Odisha,+91-0151-41383254,https://www.rubyivffertilitybayivf.com,Advanced assisted reproductive technology center
Crystal IVF Fertility Plain,"713 Indira Colony, Bharatpur, Rajasthan",Bharatpur,Rajasthan,+91-0136-12754709,https://www.crystalivffertilityplainhospital.com,Modern fertility clinic equipped with latest medical technology
Shivani IVF Destination,"587 Ambedkar Clinic, Jammu, Jammu and Kashmir",Jammu,Jammu and Kashmir,+91-0129-43327474,https://www.shivaniivfdestinationivf.com,Advanced fertility clinic with cutting-edge technology
Chosen Fertility IVF Quest,"425 New Street, Gandhinagar, Gujarat",Gandhinagar,Gujarat,+91-0158-88197413,https://www.chosenfertilityivfquestfertility.com,Leading center for assisted reproductive technologies
Superb Fertility Fertility Care,"155 Central Avenue, Ambernath, Maharashtra",Ambernath,Maharashtra,+91-0175-36027339,https://www.superbfertilityfertilitycarefertility.com,Specialized center for infertility diagnosis and treatment
Golden IVF IVF Savannah,"169 Gandhi Avenue, Jammu, Jammu and Kashmir",Jammu,Jammu and Kashmir,+91-0178-21697729,https://www.goldenivfivfsavannahmedical.com,Advanced fertility clinic with cutting-edge technology
Select Fertility IVF Lab,"457 Vijay Lane, Muzaffarpur, Bihar",Muzaffarpur,Bihar,+91-0162-81083970,https://www.selectfertilityivflabmedical.com,Modern fertility clinic equipped with latest medical technology
Exceptional IVF Fertility Brook,"154 Rajiv Road, Mysore, Karnataka",Mysore,Karnataka,+91-0189-65361652,https://www.exceptionalivffertilitybrookmedical.com,Expert fertility specialists providing comprehensive care
Top IVF Fertility Path,"56 MG Nagar, Deoghar, Jharkhand",Deoghar,Jharkhand,+91-0140-49618300,https://www.topivffertilitypathcenter.com,Expert fertility specialists providing comprehensive care
Elite Fertility IVF Prairie,"22 Sardar Patel Colony, Faridabad, Haryana",Faridabad,Haryana,+91-0171-20736616,https://www.elitefertilityivfprairiecare.com,Specialized IVF clinic with experienced fertility specialists
Elite IVF IVF Yacht,"955 Old Colony, Bhatpara, West Bengal",Bhatpara,West Bengal,+91-0124-49156682,https://www.eliteivfivfyachtcare.com,Advanced assisted reproductive technology center
Ultimate IVF Fertility Bridge,"16 Sonia Complex, Amroha, Uttar Pradesh",Amroha,Uttar Pradesh,+91-080-13893608,https://www.ultimateivffertilitybridgeclinic.com,Comprehensive infertility treatment with state-of-the-art technology
Genesis IVF Court,"590 Tagore Complex, Morena, Madhya Pradesh",Morena,Madhya Pradesh,+91-0199-61256830,https://www.genesisivfcourtivf.com,Expert fertility care with personalized treatment plans
Ideal Fertility IVF Lake,"983 Nehru Lane, Madhyamgram, West Bengal",Madhyamgram,West Bengal,+91-0181-79321144,https://www.idealfertilityivflakecare.com,Comprehensive infertility treatment solutions
Chosen Fertility Fertility Port,"432 Indira Road, Rampur, Uttar Pradesh",Rampur,Uttar Pradesh,+91-0191-50409281,https://www.chosenfertilityfertilityportfertility.com,Complete reproductive health and fertility services
Crystal IVF Fertility Avenue,"158 Block Complex, Rajpur Sonarpur, West Bengal",Rajpur Sonarpur,West Bengal,+91-0147-85220274,https://www.crystalivffertilityavenuefertility.com,Specialized center for infertility diagnosis and treatment
Platinum IVF Fertility Peninsula,"479 Central Nagar, Sikar, Rajasthan",Sikar,Rajasthan,+91-0164-98854059,https://www.platinumivffertilitypeninsulacenter.com,Advanced fertility clinic with cutting-edge technology
Great IVF Fertility Pool,"615 Jawaharlal Nehru Complex, Hapur, Uttar Pradesh",Hapur,Uttar Pradesh,+91-0153-27576512,https://www.greativffertilitypoolhealth.com,Dedicated to helping couples achieve their dream of parenthood
Top IVF Fertility River,"751 Phase Lane, Solapur, Maharashtra",Solapur,Maharashtra,+91-0189-85444122,https://www.topivffertilityrivercare.com,Advanced reproductive medicine center with high success rates
Miracle Fertility Ship,"410 Gandhi Nagar Colony, Bikaner, Rajasthan",Bikaner,Rajasthan,+91-0168-88261754,https://www.miraclefertilityshipclinic.com,Comprehensive infertility treatment solutions
Leading IVF Fertility Target,"661 East Complex, Durg, Chhattisgarh",Durg,Chhattisgarh,+91-0181-40476678,https://www.leadingivffertilitytargethealth.com,Advanced assisted reproductive technology center
Superior IVF Fertility Meadow,"662 Jawaharlal Nehru Center, Howrah, West Bengal",Howrah,West Bengal,+91-0125-45835283,https://www.superiorivffertilitymeadowmedical.com,"Complete fertility solutions including IVF, ICSI, and fertility preservation"
Fine Fertility Fertility Institute,"336 Tagore Avenue, Munger, Bihar",Munger,Bihar,+91-0199-75062258,https://www.finefertilityfertilityinstitutehealth.com,Comprehensive fertility treatment and reproductive health services
Premier Fertility IVF Center,"342 Block Colony, Shahjahanpur, Uttar Pradesh",Shahjahanpur,Uttar Pradesh,+91-0180-52558943,https://www.premierfertilityivfcenterhealth.com,Dedicated to helping couples achieve their dream of parenthood
Ultimate IVF IVF Services,"505 West Nagar, Bhopal, Madhya Pradesh",Bhopal,Madhya Pradesh,+91-0120-94910740,https://www.ultimateivfivfservicesclinic.com,Specialized fertility care and reproductive medicine
Wonderful Fertility Fertility Aim,"706 Modi Avenue, Delhi, Delhi",Delhi,Delhi,+91-0191-50823912,https://www.wonderfulfertilityfertilityaimmedical.com,Specialized center for infertility diagnosis and treatment
Leading IVF Fertility Way,"12 North Nagar, Firozabad, Uttar Pradesh",Firozabad,Uttar Pradesh,+91-0130-23245991,https://www.leadingivffertilitywayivf.com,Leading IVF and fertility treatment facility
Prime Fertility IVF Mission,"701 MG Center, Srinagar, Jammu and Kashmir",Srinagar,Jammu and Kashmir,+91-0191-64548302,https://www.primefertilityivfmissionhealth.com,Leading IVF and fertility treatment facility
Prime Fertility Fertility Valley,"573 Main Clinic, Nellore, Andhra Pradesh",Nellore,Andhra Pradesh,+91-0146-32949081,https://www.primefertilityfertilityvalleycare.com,Advanced reproductive medicine center with high success rates
Wonderful Fertility IVF Peak,"531 West Lane, Mysore, Karnataka",Mysore,Karnataka,+91-0191-87508744,https://www.wonderfulfertilityivfpeakmedical.com,Advanced IVF clinic with proven success rates
Leading IVF IVF Ferry,"777 North Nagar, Mathura, Uttar Pradesh",Mathura,Uttar Pradesh,+91-0135-45693043,https://www.leadingivfivfferryclinic.com,Comprehensive fertility treatment and reproductive health services
Oasis Fertility Solutions,"937 Main Avenue, Bhilwara, Rajasthan",Bhilwara,Rajasthan,+91-0166-97360514,https://www.oasisfertilitysolutionscare.com,Leading fertility treatment center offering advanced ART procedures
Ultimate IVF Fertility Horizon,"633 Sonia Road, Karawal Nagar, Delhi",Karawal Nagar,Delhi,+91-0152-74023736,https://www.ultimateivffertilityhorizoncare.com,Advanced IVF clinic with proven success rates
Great IVF Fertility Horizon,"310 North Center, Amroha, Uttar Pradesh",Amroha,Uttar Pradesh,+91-0138-88768146,https://www.greativffertilityhorizonhealth.com,Leading IVF and fertility treatment facility
Choice IVF IVF Hope,"194 South Street, Vellore, Tamil Nadu",Vellore,Tamil Nadu,+91-0172-49049306,https://www.choiceivfivfhopehospital.com,"Complete fertility solutions including IVF, ICSI, and fertility preservation"
Golden IVF IVF Clinic,"406 Central Nagar, Bijapur, Karnataka",Bijapur,Karnataka,+91-0153-96086983,https://www.goldenivfivfcliniccare.com,Comprehensive infertility treatment with state-of-the-art technology
Exceptional IVF IVF Oasis,"504 Tagore Complex, Malegaon, Maharashtra",Malegaon,Maharashtra,+91-0166-78822665,https://www.exceptionalivfivfoasiscare.com,Specialized IVF clinic with experienced fertility specialists
Platinum IVF Fertility Stream,"745 South Clinic, Panchkula, Haryana",Panchkula,Haryana,+91-0121-95583569,https://www.platinumivffertilitystreamhealth.com,State-of-the-art fertility treatment center
Excellent IVF Fertility Desert,"16 Central Avenue, Thiruvananthapuram, Kerala",Thiruvananthapuram,Kerala,+91-0141-40902922,https://www.excellentivffertilitydesertmedical.com,Expert fertility care with personalized treatment plans
