Clinic Name,Address,City,State,Phone,Website,Description
Milann Fertility Lab,"471 Nehru Colony, Mahesana, Gujarat",Mahesana,Gujarat,+91-0152-21929861,https://www.milannfertilitylabmedical.com,Dedicated to helping couples achieve their dream of parenthood
Vani IVF Treatment,"245 Old Avenue, Nashik, Maharashtra",Nashik,Maharashtra,+91-0135-78308860,https://www.vaniivftreatmentivf.com,Advanced reproductive medicine center with high success rates
Sapphire Fertility IVF River,"369 Main Hospital, Jamnagar, Gujarat",Jamnagar,Gujarat,+91-0179-67211785,https://www.sapphirefertilityivfriverivf.com,Dedicated to helping couples achieve their dream of parenthood
Fine Fertility Fertility Dream,"841 North Nagar, Gwalior, Madhya Pradesh",Gwalior,Madhya Pradesh,+91-0190-93684889,https://www.finefertilityfertilitydreamhealth.com,Comprehensive infertility treatment with state-of-the-art technology
Fertility First Fertility Oasis,"988 Sonia Nagar, Bhavnagar, Gujarat",Bhavnagar,Gujarat,+91-0198-19795356,https://www.fertilityfirstfertilityoasisclinic.com,State-of-the-art fertility treatment center
Ruby IVF Fertility Harbor,"460 Central Avenue, Nagarcoil, Tamil Nadu",Nagarcoil,Tamil Nadu,+91-0198-86262544,https://www.rubyivffertilityharborclinic.com,"Complete fertility solutions including IVF, ICSI, and fertility preservation"
Premium Fertility IVF Hill,"549 Bose Avenue, Kozhikode, Kerala",Kozhikode,Kerala,+91-0151-91314046,https://www.premiumfertilityivfhillhealth.com,Leading center for assisted reproductive technologies
Platinum IVF Fertility Lake,"44 Main Clinic, Bidhan Nagar, West Bengal",Bidhan Nagar,West Bengal,+91-0186-56578810,https://www.platinumivffertilitylakehospital.com,Advanced reproductive medicine center with high success rates
Elite IVF Fertility Field,"970 West Colony, Ludhiana, Punjab",Ludhiana,Punjab,+91-0168-22083254,https://www.eliteivffertilityfieldivf.com,Expert fertility specialists providing comprehensive care
Life Line IVF River,"996 Block Complex, Srinagar, Jammu and Kashmir",Srinagar,Jammu and Kashmir,+91-040-31108405,https://www.lifelineivfrivercenter.com,Specialized center for infertility diagnosis and treatment
Perfect IVF Fertility Dream,"686 Ashok Lane, Pondicherry, Puducherry",Pondicherry,Puducherry,+91-0129-67128068,https://www.perfectivffertilitydreamhealth.com,Advanced fertility clinic with cutting-edge technology
Care IVF IVF Future,"400 South Colony, Bengaluru, Karnataka",Bengaluru,Karnataka,+91-0163-94512479,https://www.careivfivffuturefertility.com,Leading IVF and fertility treatment facility
Outstanding IVF IVF Cape,"315 Sector Nagar, Munger, Bihar",Munger,Bihar,+91-0126-56497164,https://www.outstandingivfivfcapehealth.com,Specialized IVF clinic with experienced fertility specialists
Genesis Fertility Causeway,"676 Sardar Patel Colony, Rourkela, Odisha",Rourkela,Odisha,+91-0152-63494173,https://www.genesisfertilitycausewaycare.com,Specialized IVF clinic with experienced fertility specialists
Fantastic Fertility IVF Island,"467 Old Avenue, Bhiwandi, Maharashtra",Bhiwandi,Maharashtra,+91-020-28241260,https://www.fantasticfertilityivfislandhospital.com,Advanced IVF clinic with proven success rates
Select Fertility IVF Future,"603 Sardar Patel Hospital, Maheshtala, West Bengal",Maheshtala,West Bengal,+91-0145-31598826,https://www.selectfertilityivffuturecare.com,State-of-the-art fertility treatment center
Nice Fertility IVF Port,"470 Vijay Center, Saharanpur, Uttar Pradesh",Saharanpur,Uttar Pradesh,+91-0149-35191532,https://www.nicefertilityivfportfertility.com,Specialized IVF clinic with experienced fertility specialists
Amazing IVF Fertility Yacht,"259 Raj Lane, Rajahmundry, Andhra Pradesh",Rajahmundry,Andhra Pradesh,+91-0142-45831016,https://www.amazingivffertilityyachtclinic.com,Advanced assisted reproductive technology center
Outstanding IVF IVF Canal,"453 Block Nagar, Yamunanagar, Haryana",Yamunanagar,Haryana,+91-0140-69463645,https://www.outstandingivfivfcanalcenter.com,Complete reproductive health and fertility services
Excel IVF IVF Square,"119 Gandhi Center, Anand, Gujarat",Anand,Gujarat,+91-0137-34437457,https://www.excelivfivfsquarehealth.com,Comprehensive fertility treatment and reproductive health services
Perfect IVF IVF Cape,"787 West Street, Bhubaneswar, Odisha",Bhubaneswar,Odisha,+91-0185-43578317,https://www.perfectivfivfcapeclinic.com,Modern fertility clinic equipped with latest medical technology
Chosen Fertility IVF Aqueduct,"458 Raj Nagar, Sikar, Rajasthan",Sikar,Rajasthan,+91-0170-50792656,https://www.chosenfertilityivfaqueductclinic.com,Expert fertility care with personalized treatment plans
Golden IVF Fertility Street,"763 Phase Road, Navsari, Gujarat",Navsari,Gujarat,+91-0129-90387668,https://www.goldenivffertilitystreetmedical.com,Complete reproductive health and fertility services
Platinum IVF IVF Expedition,"865 West Colony, Kamarhati, West Bengal",Kamarhati,West Bengal,+91-0135-21552544,https://www.platinumivfivfexpeditioncare.com,Leading fertility treatment center offering advanced ART procedures
Platinum IVF Fertility Dam,"180 West Hospital, Rampur, Uttar Pradesh",Rampur,Uttar Pradesh,+91-0194-56896192,https://www.platinumivffertilitydamfertility.com,"Complete fertility solutions including IVF, ICSI, and fertility preservation"
Morpheus Fertility Street,"10 MG Avenue, Ratlam, Madhya Pradesh",Ratlam,Madhya Pradesh,+91-040-59145341,https://www.morpheusfertilitystreetfertility.com,Expert fertility care with personalized treatment plans
Amazing IVF Fertility Lake,"681 Sonia Complex, Asansol, West Bengal",Asansol,West Bengal,+91-040-67137222,https://www.amazingivffertilitylakehospital.com,Expert fertility care with personalized treatment plans
Fine Fertility Infertility Centre,"883 Shivaji Nagar, Ulhasnagar, Maharashtra",Ulhasnagar,Maharashtra,+91-0197-56472135,https://www.finefertilityinfertilitycentrehealth.com,Complete reproductive health and fertility services
Exceptional IVF IVF Mountain,"840 West Street, Howrah, West Bengal",Howrah,West Bengal,+91-0144-76224640,https://www.exceptionalivfivfmountainhealth.com,Complete reproductive health and fertility services
Exceptional IVF Fertility Adventure,"248 East Road, Ratlam, Madhya Pradesh",Ratlam,Madhya Pradesh,+91-0147-14283372,https://www.exceptionalivffertilityadventuremedical.com,Leading IVF and fertility treatment facility
Top IVF IVF Cruise,"824 Block Lane, Ajmer, Rajasthan",Ajmer,Rajasthan,+91-0179-32927183,https://www.topivfivfcruisehealth.com,Leading center for assisted reproductive technologies
Chosen Fertility Fertility Voyage,"946 South Clinic, Erode, Tamil Nadu",Erode,Tamil Nadu,+91-0197-12092400,https://www.chosenfertilityfertilityvoyagecare.com,Leading fertility treatment center offering advanced ART procedures
Best Fertility IVF Road,"360 Shivaji Lane, Nagercoil, Tamil Nadu",Nagercoil,Tamil Nadu,+91-0194-73331661,https://www.bestfertilityivfroadclinic.com,Specialized fertility care and reproductive medicine
Superior Fertility IVF Boulevard,"414 Ashok Colony, Jamshedpur, Jharkhand",Jamshedpur,Jharkhand,+91-0164-96523744,https://www.superiorfertilityivfboulevardcare.com,Advanced IVF clinic with proven success rates
Superb Fertility IVF Horizon,"480 Ambedkar Avenue, Firozabad, Uttar Pradesh",Firozabad,Uttar Pradesh,+91-0161-38096985,https://www.superbfertilityivfhorizoncare.com,Advanced IVF clinic with proven success rates
Premium Fertility IVF Expedition,"998 South Center, Nadiad, Gujarat",Nadiad,Gujarat,+91-0161-24995848,https://www.premiumfertilityivfexpeditionhealth.com,State-of-the-art fertility treatment center
Preferred IVF Fertility Dream,"275 Jawaharlal Nehru Avenue, Tirupati, Andhra Pradesh",Tirupati,Andhra Pradesh,+91-0128-81087379,https://www.preferredivffertilitydreammedical.com,Expert fertility care with personalized treatment plans
Supreme Fertility Fertility Aim,"157 Block Center, Vasai-Virar, Maharashtra",Vasai-Virar,Maharashtra,+91-0181-80047389,https://www.supremefertilityfertilityaimfertility.com,Complete reproductive health and fertility services
Preferred IVF IVF River,"505 Vijay Clinic, New Delhi, Delhi",New Delhi,Delhi,+91-0168-71448388,https://www.preferredivfivfriverfertility.com,Comprehensive infertility treatment solutions
Sapphire Fertility Fertility Field,"263 Old Street, Bhilwara, Rajasthan",Bhilwara,Rajasthan,+91-0156-49671310,https://www.sapphirefertilityfertilityfieldfertility.com,Specialized fertility care and reproductive medicine
Best Fertility IVF Mission,"221 Old Complex, Korba, Chhattisgarh",Korba,Chhattisgarh,+91-0130-78411031,https://www.bestfertilityivfmissionclinic.com,Advanced reproductive medicine center with high success rates
Care IVF IVF Way,"385 Main Street, Pune, Maharashtra",Pune,Maharashtra,+91-0138-68384041,https://www.careivfivfwaycare.com,Specialized center for infertility diagnosis and treatment
Amazing IVF IVF Services,"89 New Complex, Ambattur, Tamil Nadu",Ambattur,Tamil Nadu,+91-033-16586691,https://www.amazingivfivfservicesclinic.com,Specialized IVF clinic with experienced fertility specialists
Top IVF Fertility Cruise,"966 Main Avenue, Biharsharif, Bihar",Biharsharif,Bihar,+91-0129-69443703,https://www.topivffertilitycruiseivf.com,Advanced assisted reproductive technology center
Elite IVF Fertility,"769 Indira Avenue, Uluberia, West Bengal",Uluberia,West Bengal,+91-0121-34830264,https://www.eliteivffertilitycare.com,Advanced assisted reproductive technology center
Nice Fertility Fertility Services,"373 East Avenue, Vijayanagaram, Andhra Pradesh",Vijayanagaram,Andhra Pradesh,+91-0183-38372343,https://www.nicefertilityfertilityservicescare.com,Specialized IVF clinic with experienced fertility specialists
Supreme Fertility Fertility Dam,"608 New Clinic, Jamshedpur, Jharkhand",Jamshedpur,Jharkhand,+91-0138-51035038,https://www.supremefertilityfertilitydamclinic.com,Leading IVF and fertility treatment facility
Outstanding IVF Fertility Spring,"409 Ambedkar Road, Surat, Gujarat",Surat,Gujarat,+91-0193-27478094,https://www.outstandingivffertilityspringmedical.com,Leading IVF and fertility treatment facility
Ruby IVF Fertility Way,"936 Tagore Avenue, Noida, Uttar Pradesh",Noida,Uttar Pradesh,+91-0147-80799611,https://www.rubyivffertilitywayclinic.com,Dedicated to helping couples achieve their dream of parenthood
Premium Fertility IVF Viaduct,"344 Nehru Hospital, Surat, Gujarat",Surat,Gujarat,+91-080-56128266,https://www.premiumfertilityivfviaductcenter.com,Advanced assisted reproductive technology center
Good IVF Fertility Way,"144 Tagore Road, Chittoor, Andhra Pradesh",Chittoor,Andhra Pradesh,+91-0190-31962649,https://www.goodivffertilitywaymedical.com,State-of-the-art fertility treatment center
Nice Fertility IVF Pool,"463 Bose Colony, Bulandshahr, Uttar Pradesh",Bulandshahr,Uttar Pradesh,+91-080-54077939,https://www.nicefertilityivfpoolhospital.com,Specialized center for infertility diagnosis and treatment
Premium IVF Fertility Cruise,"20 Old Road, Nashik, Maharashtra",Nashik,Maharashtra,+91-0135-76599447,https://www.premiumivffertilitycruiseclinic.com,Specialized fertility care and reproductive medicine
Ultimate IVF IVF Field,"775 Shivaji Lane, Hapur, Uttar Pradesh",Hapur,Uttar Pradesh,+91-0194-51139342,https://www.ultimateivfivffieldfertility.com,Specialized IVF clinic with experienced fertility specialists
Ideal Fertility Fertility Court,"652 Phase Street, Bhind, Madhya Pradesh",Bhind,Madhya Pradesh,+91-022-46060312,https://www.idealfertilityfertilitycourthealth.com,Complete reproductive health and fertility services
Sapphire Fertility IVF Peninsula,"291 Shivaji Hospital, Coimbatore, Tamil Nadu",Coimbatore,Tamil Nadu,+91-0149-60459809,https://www.sapphirefertilityivfpeninsulacenter.com,Complete reproductive health and fertility services
Royal IVF IVF Dream,"718 Block Avenue, Jhansi, Uttar Pradesh",Jhansi,Uttar Pradesh,+91-0163-78994909,https://www.royalivfivfdreamhealth.com,"Complete fertility solutions including IVF, ICSI, and fertility preservation"
Top IVF IVF Dam,"517 North Nagar, Khandwa, Madhya Pradesh",Khandwa,Madhya Pradesh,+91-0142-73496956,https://www.topivfivfdamfertility.com,Leading fertility treatment center offering advanced ART procedures
Exceptional IVF Fertility Boat,"421 Ambedkar Nagar, Yamunanagar, Haryana",Yamunanagar,Haryana,+91-0191-18243561,https://www.exceptionalivffertilityboathospital.com,Complete reproductive health and fertility services
Wonderful Fertility IVF Tunnel,"488 Block Road, Munger, Bihar",Munger,Bihar,+91-0173-12631775,https://www.wonderfulfertilityivftunnelhospital.com,Leading IVF and fertility treatment facility
Amazing IVF IVF Street,"501 Indira Complex, Bellary, Karnataka",Bellary,Karnataka,+91-0126-99220108,https://www.amazingivfivfstreetclinic.com,State-of-the-art fertility treatment center
Remarkable Fertility Fertility Goal,"414 Bose Center, Jabalpur, Madhya Pradesh",Jabalpur,Madhya Pradesh,+91-0182-20782550,https://www.remarkablefertilityfertilitygoalcare.com,Expert fertility specialists providing comprehensive care
Supreme Fertility Fertility Solutions,"335 New Lane, Gandhidham, Gujarat",Gandhidham,Gujarat,+91-0127-11535884,https://www.supremefertilityfertilitysolutionsfertility.com,Advanced fertility clinic with cutting-edge technology
Ideal Fertility IVF Meadow,"424 Old Center, Asansol, West Bengal",Asansol,West Bengal,+91-0173-67871943,https://www.idealfertilityivfmeadowcenter.com,Expert fertility specialists providing comprehensive care
Royal IVF Fertility Pond,"890 Block Clinic, Amravati, Maharashtra",Amravati,Maharashtra,+91-0168-73909730,https://www.royalivffertilitypondcare.com,Comprehensive infertility treatment with state-of-the-art technology
Remarkable Fertility Fertility Mission,"421 Rajiv Colony, Mumbai, Maharashtra",Mumbai,Maharashtra,+91-0120-51511631,https://www.remarkablefertilityfertilitymissionhospital.com,Advanced assisted reproductive technology center
Ultimate IVF IVF Meadow,"583 Central Center, Belgaum, Karnataka",Belgaum,Karnataka,+91-0183-85158948,https://www.ultimateivfivfmeadowhealth.com,Comprehensive infertility treatment solutions
Exceptional IVF IVF Plan,"475 Bose Avenue, Madhyamgram, West Bengal",Madhyamgram,West Bengal,+91-0141-62604511,https://www.exceptionalivfivfplanmedical.com,Leading IVF and fertility treatment facility
Great IVF Fertility Meadow,"706 Main Nagar, Durgapur, West Bengal",Durgapur,West Bengal,+91-0122-92730155,https://www.greativffertilitymeadowhealth.com,Specialized fertility care and reproductive medicine
Ideal Fertility IVF Crest,"624 Phase Street, Bhalswa Jahangir Pur, Delhi",Bhalswa Jahangir Pur,Delhi,+91-080-26824519,https://www.idealfertilityivfcresthospital.com,Comprehensive infertility treatment solutions
Platinum IVF IVF Peak,"211 Sonia Hospital, Aligarh, Uttar Pradesh",Aligarh,Uttar Pradesh,+91-0124-42539358,https://www.platinumivfivfpeakhealth.com,Comprehensive infertility treatment with state-of-the-art technology
Fine Fertility IVF Desert,"826 Old Road, Arrah, Bihar",Arrah,Bihar,+91-0198-43422807,https://www.finefertilityivfdeserthospital.com,Comprehensive fertility treatment and reproductive health services
Great IVF IVF Plain,"739 East Lane, Jodhpur, Rajasthan",Jodhpur,Rajasthan,+91-0152-49157961,https://www.greativfivfplainhealth.com,State-of-the-art fertility treatment center
Sapphire Fertility Fertility Aqueduct,"70 Sardar Patel Avenue, Bhilai, Chhattisgarh",Bhilai,Chhattisgarh,+91-0177-76907470,https://www.sapphirefertilityfertilityaqueductcare.com,Advanced reproductive medicine center with high success rates
Fantastic Fertility Fertility Creek,"29 Sonia Street, Bidar, Karnataka",Bidar,Karnataka,+91-0192-94288562,https://www.fantasticfertilityfertilitycreekhospital.com,Specialized center for infertility diagnosis and treatment
Choice IVF Fertility Street,"172 Shivaji Clinic, Tiruvottiyur, Tamil Nadu",Tiruvottiyur,Tamil Nadu,+91-0186-31253469,https://www.choiceivffertilitystreetivf.com,State-of-the-art fertility treatment center
Optimal IVF IVF Desert,"126 Modi Colony, Thoothukudi, Tamil Nadu",Thoothukudi,Tamil Nadu,+91-0181-89948997,https://www.optimalivfivfdesertmedical.com,Advanced IVF clinic with proven success rates
Chosen Fertility IVF Desert,"896 North Lane, Tiruvottiyur, Tamil Nadu",Tiruvottiyur,Tamil Nadu,+91-0124-17390191,https://www.chosenfertilityivfdesertfertility.com,Specialized fertility care and reproductive medicine
